{
  "id": "5887e45d-5903-43d9-906d-bb48601aed21",
  "slug": "aaron-hazen",
  "name": {
    "display": "Aaron Hazen",
    "first": "Aaron",
    "last": "Hazen",
    "aliases": []
  },
  "emails": [],
  "phones": [],
  "companies": [
    {
      "name": "FrogBear",
      "current": true
    }
  ],
  "title": "",
  "identifiers": {
    "slack": [
      {
        "workspace": "frogbearventures",
        "userId": "U08RANNQC5C",
        "dmChannel": "D08RANPFLFQ"
      }
    ]
  },
  "sources": [
    {
      "type": "migration",
      "date": "2026-02-22T04:42:57.288Z",
      "context": "Initial CRM seed from HQ knowledge files",
      "ref": "knowledge/integrations/slack.md"
    }
  ],
  "interactions": [],
  "tags": [],
  "notes": "Co-founder, primary contact",
  "createdAt": "2026-02-22T04:42:57.562Z",
  "updatedAt": "2026-02-22T04:42:57.562Z"
}
