{
  "id": "97662708-6a07-48ac-a2a1-87954d4abb80",
  "slug": "geoff",
  "name": {
    "display": "Geoff",
    "first": "Geoff",
    "last": "",
    "aliases": []
  },
  "emails": [],
  "phones": [],
  "companies": [
    {
      "name": "Indigo",
      "current": true
    }
  ],
  "title": "",
  "identifiers": {
    "slack": [
      {
        "workspace": "indigo-ai",
        "userId": "U08CLD74BFC"
      }
    ]
  },
  "sources": [
    {
      "type": "migration",
      "date": "2026-02-22T04:42:57.288Z",
      "context": "Initial CRM seed from HQ knowledge files",
      "ref": "knowledge/integrations/slack.md"
    }
  ],
  "interactions": [],
  "tags": [],
  "notes": "",
  "createdAt": "2026-02-22T04:42:57.532Z",
  "updatedAt": "2026-02-22T04:42:57.532Z"
}
