{
  "id": "63547e84-e847-43e5-9d5f-786b324db1a4",
  "slug": "yousuf-kalim",
  "name": {
    "display": "Yousuf Kalim",
    "first": "Yousuf",
    "last": "Kalim",
    "aliases": []
  },
  "emails": [],
  "phones": [],
  "companies": [
    {
      "name": "Indigo",
      "current": true
    }
  ],
  "title": "",
  "identifiers": {
    "slack": [
      {
        "workspace": "indigo-ai",
        "userId": "U0823D5QDJM"
      }
    ],
    "linear": [
      {
        "workspace": "indigo-ai",
        "userId": "308407ca-7a92-4017-8e80-9a220dd66cc5"
      }
    ]
  },
  "sources": [
    {
      "type": "migration",
      "date": "2026-02-22T04:42:57.288Z",
      "context": "Initial CRM seed from HQ knowledge files",
      "ref": "knowledge/integrations/slack.md"
    },
    {
      "type": "migration",
      "date": "2026-02-22T04:42:57.288Z",
      "context": "Initial CRM seed from HQ knowledge files",
      "ref": "knowledge/integrations/linear.md"
    }
  ],
  "interactions": [],
  "tags": [],
  "notes": "",
  "createdAt": "2026-02-22T04:42:57.486Z",
  "updatedAt": "2026-02-22T04:42:57.486Z"
}
