{
  "id": "ebac2277-e981-4eec-aead-c5c0e54ccaa9",
  "slug": "hassaan-saleem",
  "name": {
    "display": "Hassaan Saleem",
    "first": "Hassaan",
    "last": "Saleem",
    "aliases": []
  },
  "emails": [],
  "phones": [],
  "companies": [
    {
      "name": "Indigo",
      "current": true
    }
  ],
  "title": "",
  "identifiers": {
    "slack": [
      {
        "workspace": "indigo-ai",
        "userId": "U082XQ9F70Q"
      }
    ]
  },
  "sources": [
    {
      "type": "migration",
      "date": "2026-02-22T04:42:57.288Z",
      "context": "Initial CRM seed from HQ knowledge files",
      "ref": "knowledge/integrations/slack.md"
    }
  ],
  "interactions": [],
  "tags": [],
  "notes": "",
  "createdAt": "2026-02-22T04:42:57.513Z",
  "updatedAt": "2026-02-22T04:42:57.513Z"
}
