{
  "id": "dbc8bc6d-1e36-4148-893a-8046b7447c4f",
  "slug": "ahmed-bilal",
  "name": {
    "display": "Ahmed Bilal",
    "first": "Ahmed",
    "last": "Bilal",
    "aliases": []
  },
  "emails": [],
  "phones": [],
  "companies": [
    {
      "name": "Indigo",
      "current": true
    }
  ],
  "title": "",
  "identifiers": {
    "slack": [
      {
        "workspace": "indigo-ai",
        "userId": "U09FZLWP0AJ"
      }
    ]
  },
  "sources": [
    {
      "type": "migration",
      "date": "2026-02-22T04:42:57.288Z",
      "context": "Initial CRM seed from HQ knowledge files",
      "ref": "knowledge/integrations/slack.md"
    }
  ],
  "interactions": [],
  "tags": [],
  "notes": "",
  "createdAt": "2026-02-22T04:42:57.549Z",
  "updatedAt": "2026-02-22T04:42:57.549Z"
}
