{
  "id": "4b4454dc-119a-4c61-b96e-19fe7f698ce1",
  "slug": "stefan-johnson",
  "name": {
    "display": "Stefan Johnson",
    "first": "Stefan",
    "last": "Johnson",
    "aliases": []
  },
  "emails": [],
  "phones": [],
  "companies": [
    {
      "name": "Indigo",
      "current": true
    },
    {
      "name": "FrogBear",
      "current": true
    }
  ],
  "title": "Software Engineer",
  "identifiers": {
    "slack": [
      {
        "workspace": "indigo-ai",
        "userId": "U065YSKUCJK"
      },
      {
        "workspace": "frogbearventures",
        "userId": "U08RUDAR4FK"
      }
    ],
    "linear": [
      {
        "workspace": "indigo-ai",
        "userId": "0f41fe7e-9ad7-4de3-8e70-10aa7b42d001",
        "displayName": "therealstefan"
      }
    ],
    "twitter": [
      {
        "handle": "sfstefan"
      }
    ]
  },
  "sources": [
    {
      "type": "migration",
      "date": "2026-02-22T04:42:57.288Z",
      "context": "Initial CRM seed from HQ knowledge files",
      "ref": "knowledge/integrations/slack.md"
    },
    {
      "type": "migration",
      "date": "2026-02-22T04:42:57.288Z",
      "context": "Initial CRM seed from HQ knowledge files",
      "ref": "knowledge/integrations/linear.md"
    },
    {
      "type": "migration",
      "date": "2026-02-22T04:42:57.288Z",
      "context": "Initial CRM seed from HQ knowledge files",
      "ref": "agents.md"
    }
  ],
  "interactions": [],
  "tags": [
    "self"
  ],
  "notes": "",
  "createdAt": "2026-02-22T04:42:57.422Z",
  "updatedAt": "2026-02-22T04:42:57.422Z"
}
