{
  "id": "21a32f11-4be8-4ca4-a7d9-0bd12ab056ed",
  "slug": "corey-epstein",
  "name": {
    "display": "Corey Epstein",
    "first": "Corey",
    "last": "Epstein",
    "aliases": []
  },
  "emails": [],
  "phones": [],
  "companies": [
    {
      "name": "Indigo",
      "current": true
    }
  ],
  "title": "",
  "identifiers": {
    "slack": [
      {
        "workspace": "indigo-ai",
        "userId": "U042Z9XCRK3",
        "dmChannel": "D0672CEKJ1E"
      }
    ],
    "linear": [
      {
        "workspace": "indigo-ai",
        "userId": "be96bce2-6da6-42cf-a834-21f2fa687662",
        "displayName": "corey1"
      }
    ]
  },
  "sources": [
    {
      "type": "migration",
      "date": "2026-02-22T04:42:57.288Z",
      "context": "Initial CRM seed from HQ knowledge files",
      "ref": "knowledge/integrations/slack.md"
    },
    {
      "type": "migration",
      "date": "2026-02-22T04:42:57.288Z",
      "context": "Initial CRM seed from HQ knowledge files",
      "ref": "knowledge/integrations/linear.md"
    }
  ],
  "interactions": [],
  "tags": [],
  "notes": "Stefan's partner, main HQ driver",
  "createdAt": "2026-02-22T04:42:57.388Z",
  "updatedAt": "2026-02-22T04:42:57.388Z"
}
